Title;Abstract;Type;Cause;Authors;Year
A Model of Fast Concept Inference with Object-Factorized Cognitive Programs;The ability of humans to quickly identify general concepts from a handful of images has proven difficult to emulate with robots. Recently, a computer architecture was developed that allows robots to mimic some aspects of this human ability by modeling concepts as cognitive programs using an instruction set of primitive cognitive functions. This allowed a robot to emulate human imagination by simulating candidate programs in a world model before generalizing to the physical world. However, this model used a naive search algorithm that required 30 minutes to discover a single concept, and became intractable for programs with more than 20 instructions. To circumvents this bottleneck, we present an algorithm that emulates the human cognitive heuristics of object factorization and sub-goaling, allowing human-level inference speed, improving accuracy, and making the output more explainable. © 2020 The Author(s);vision;no us;Anonymous CogSci submission;2020
A new neural network feature importance method: Application to mobile robots controllers gain tuning;This paper proposes a new approach for feature importance of neural networks and subsequently a methodology using the novel feature importance to determine useful sensor information in high performance controllers, using a trained neural network that predicts the quasi-optimal gain in real time. The neural network is trained using the Covariance Matrix Adaptation Evolution Strategy (CMA-ES) algorithm, in order to lower a given objective function. The important sensor information for robotic control are determined using the described methodology. Then a proposed improvement to the tested control law is given, and compared with the neural network’s gain prediction method for real time gain tuning. As a results, crucial information about the importance of a given sensory information for robotic control is determined, and shown to improve the performance of existing controllers. Copyright © 2020 by SCITEPRESS – Science and Technology Publications, Lda. All rights reserved.;navigation;no us;Hill A., Lucet E., Lenain R.;2020
A Risk-Aware Architecture for Autonomous Vehicle Operation under Uncertainty;A significant barrier to deploying autonomous vehicles (AVs) on a massive scale is safety assurance. Several technical challenges arise due to the uncertain environment in which AVs operate, such as road and weather conditions, errors in perception and sensory data, and model inaccuracy. This paper proposes a system architecture for risk-aware AVs capable of reasoning about uncertainty and deliberately bounding collision risk below a given threshold. The system comprises of three main subsystems. First, a perception subsystem that detects objects within a scene and quantifies the uncertainty arising from different sensing and communication modalities. Second, an intention recognition subsystem that predicts the driving-style and the intention of agent vehicles and pedestrians. Third, a planning subsystem that takes into account the aggregate uncertainty, from perception, intention recognition, and tracking error, and outputs control policies that explicitly bound the probability of collision. We deliberate further on the planner and show, in simulation, that tuning a risk parameter can significantly alter driving behavior. We believe that such a white-box approach is crucial for safe and explainable autonomous driving and the public adoption of AVs. © 2020 IEEE.;user modelling, vision, self monitoring;no us;Khonji M., Dias J., Alyassi R., Almaskari F., Seneviratne L.;2020
An Argumentation-Based Approach for Explaining Goals Selection in Intelligent Agents;During the first step of practical reasoning, i.e. deliberation or goals selection, an intelligent agent generates a set of pursuable goals and then selects which of them he commits to achieve. Explainable Artificial Intelligence (XAI) systems, including intelligent agents, must be able to explain their internal decisions. In the context of goals selection, agents should be able to explain the reasoning path that leads them to select (or not) a certain goal. In this article, we use an argumentation-based approach for generating explanations about that reasoning path. Besides, we aim to enrich the explanations with information about emerging conflicts during the selection process and how such conflicts were resolved. We propose two types of explanations: the partial one and the complete one and a set of explanatory schemes to generate pseudo-natural explanations. Finally, we apply our proposal to the cleaner world scenario. © 2020, Springer Nature Switzerland AG.;high-level dm;no us;Morveli-Espinoza M., Tacla C.A., Jasinski H.M.R.;2020
Autonomous task planning and situation awareness in robotic surgery;The use of robots in minimally invasive surgery has improved the quality of standard surgical procedures. So far, only the automation of simple surgical actions has been investigated by researchers, while the execution of structured tasks requiring reasoning on the environment and the choice among multiple actions is still managed by human surgeons. In this paper, we propose a framework to implement surgical task automation. The framework consists of a task-level reasoning module based on answer set programming, a low-level motion planning module based on dynamic movement primitives, and a situation awareness module. The logic-based reasoning module generates explainable plans and is able to recover from failure conditions, which are identified and explained by the situation awareness module interfacing to a human supervisor, for enhanced safety. Dynamic Movement Primitives allow to replicate the dexterity of surgeons and to adapt to obstacles and changes in the environment. The framework is validated on different versions of the standard surgical training peg-and-ring task.;high-level dm;no us;"M. Ginesi; D. Meli; A. Roberti; N. Sansonetto; P. Fiorini";2020
CEN: Concept Evolution Network for Image Classification Tasks;Image classification is a challenging but fundamental task for many computer vision applications, such as self-driving, face recognition, and object tracking. The deep neural network (DNN) is a modern, powerful model to tackle this task, whose representation ability mainly comes from hidden layers. The interpretability of DNN, however, drops rapidly as the inexplicable hidden part becomes deeper and deeper. To make neural networks more explainable, we propose a novel neural network named concept evolution network (CEN), learning explicit concepts of images to help classify. Concepts evolve during training with three stages: emergence, elevation, and elimination. We design three algorithms (one primary and two improved) to train CEN. The experiment results on MNIST show our methods' feasibility and that CEN has both interpretability and adaptive learning capacity for the image classification task. In the last section, we discuss the development prospects of CEN in the future. © 2020 ACM.;vision;no us;Huang D., Chen X.;2020
Coactive design of explainable agent-based task planning and deep reinforcement learning for human-UAVs teamwork;Unmanned Aerial Vehicles (UAVs) are useful in dangerous and dynamic tasks such as search-and-rescue, forest surveillance, and anti-terrorist operations. These tasks can be solved better through the collaboration of multiple UAVs under human supervision. However, it is still difficult for human to monitor, understand, predict and control the behaviors of the UAVs due to the task complexity as well as the black-box machine learning and planning algorithms being used. In this paper, the coactive design method is adopted to analyze the cognitive capabilities required for the tasks and design the interdependencies among the heterogeneous teammates of UAVs or human for coherent collaboration. Then, an agent-based task planner is proposed to automatically decompose a complex task into a sequence of explainable subtasks under constrains of resources, execution time, social rules and costs. Besides, a deep reinforcement learning approach is designed for the UAVs to learn optimal policies of a flocking behavior and a path planner that are easy for the human operator to understand and control. Finally, a mixed-initiative action selection mechanism is used to evaluate the learned policies as well as the human's decisions. Experimental results demonstrate the effectiveness of the proposed methods. © 2020 Chinese Society of Aeronautics and Astronautics;high-level dm;task complexity, incomplete;WANG C., WU L., YAN C., WANG Z., LONG H., YU C.;2020
Effects of a Social Robot's Self-Explanations on How Humans Understand and Evaluate Its Behavior;Social robots interacting with users in real-life environments will often show surprising or even undesirable behavior. In this paper we investigate whether a robot's ability to self-explain its behavior affects the users' perception and assessment of this behavior. We propose an explanation model based on humans' folk-psychological concepts and test different explanation strategies in specifically designed HRI scenarios with robot behaviors perceived as intentional, but differently surprising or desirable. All types of explanation strategies increased the understandability and desirability of the behaviors. While merely stating an action had similar effects as giving a reason for it (an intention or need), combining both in a causal explanation helped the robot to better justify its behavior and to increase its understandability and desirability to a larger extent.;high-level dm;social;Stange S,Kopp S;2020
Event Enhanced High-Quality Image Recovery;With extremely high temporal resolution, event cameras have a large potential for robotics and computer vision. However, their asynchronous imaging mechanism often aggravates the measurement sensitivity to noises and brings a physical burden to increase the image spatial resolution. To recover high-quality intensity images, one should address both denoising and super-resolution problems for event cameras. Since events depict brightness changes, with the enhanced degeneration model by the events, the clear and sharp high-resolution latent images can be recovered from the noisy, blurry and low-resolution intensity observations. Exploiting the framework of sparse learning, the events and the low-resolution intensity observations can be jointly considered. Based on this, we propose an explainable network, an event-enhanced sparse learning network (eSL-Net), to recover the high-quality images from event cameras. After training with a synthetic dataset, the proposed eSL-Net can largely improve the performance of the state-of-the-art by 7–12 dB. Furthermore, without additional training process, the proposed eSL-Net can be easily extended to generate continuous frames with frame-rate as high as the events. © 2020, Springer Nature Switzerland AG.;vision;no us;Wang B., He J., Yu L., Xia G.-S., Yang W.;2020
Explainable Agency by Revealing Suboptimality in Child-Robot Learning Scenarios;Revealing the internal workings of a robot can help a human better understand the robot’s behaviors. How to reveal such workings, e.g., via explanation generation, remains a significant challenge. This gets even more complex when these explanations are targeted towards children. Therefore, we propose a search-based approach to generate contrastive explanations using optimal and sub-optimal plans and implement it in a scenario for children. In the application scenario, the child and the robot learn together how to play a zero-sum game that requires logical and mathematical thinking. We report results around our explanation generation system that was successfully deployed among seven-year-old children. Our results show trends that the generated explanations were able to positively affect the children’s perceived difficulty in learning the zero-sum game. © 2020, Springer Nature Switzerland AG.;high-level dm;social;Tulli S., Couto M., Vasco M., Yadollahi E., Melo F., Paiva A.;2020
Explainable Agents as Static Web Pages: UAV Simulation Example;Motivated by the apparent societal need to design complex autonomous systems whose decisions and actions are humanly intelligible, the study of explainable artificial intelligence, and with it, research on explainable autonomous agents has gained increased attention from the research community. One important objective of research on explainable agents is the evaluation of explanation approaches in human-computer interaction studies. In this demonstration paper, we present a way to facilitate such studies by implementing explainable agents and multi-agent systems that i) can be deployed as static files, not requiring the execution of server-side code, which minimizes administration and operation overhead, and ii) can be embedded into web front ends and other JavaScript-enabled user interfaces, hence increasing the ability to reach a broad range of users. We then demonstrate the approach with the help of an application that was designed to assess the effect of different explainability approaches on the human intelligibility of an unmanned aerial vehicle simulation. © 2020, Springer Nature Switzerland AG.;high-level dm;no us;Mualla Y., Kampik T., Tchappi I.H., Najjar A., Galland S., Nicolle C.;2020
Explainable and efficient sequential correlation network for 3D single person concurrent activity detection;We present the sequential correlation network (SCN) to improve concurrent activity detection. SCN combines a recurrent neural network and a correlation model hierarchically to model the complex correlations and temporal dynamics of concurrent activities. SCN has several advantages that enable effective learning even from a small dataset for real-world deployment. Unlike the majority of approaches assuming that each subject performs one activity at a time, SCN is end-to- end trainable, i.e., it can automatically learn the inclusive or exclusive relations of concurrent activities. SCN is lightweight in design using only a small set of learnable parameters to model the spatio-temporal correlations of activities. This also enhances the explainability of the learned parameters. Furthermore, the learning of SCN can benefit from the initialization using semantically meaningful priors. We evaluate the proposed method against the state-of-the-art method on two benchmark datasets with human skeletal data, SCN achieves comparable performance to the SOTA but with much faster inference speed and less memory usage. © 2020 IEEE.;user modelling, vision;no us;Wei Y., Li W., Chang M.-C., Jin H., Lyu S.;2020
Explainable post-occupancy evaluation using a humanoid robot;The paper proposes a new methodological approach for evaluating the comfort condition using the concept of explainable post occupancy to make the user aware of the environmental state in which (s)he works. Such an approach was implemented on a humanoid robot with social capabilities that aims to enforce human engagement to follow recommendations. The humanoid robot helps the user to position the sensors correctly to acquire environmental measures corresponding to the temperature, humidity, noise level, and illuminance. The distribution of the last parameter due to its high variability is also retrieved by the simulation software Dialux. Using the post occupancy evaluation method, the robot also proposes a questionnaire to the user for collecting his/her preferences and sensations. In the end, the robot explains to the user the difference between the suggested values by the technical standards and the real measures comparing the results with his/her preferences and perceptions. Finally, it provides a new classification into four clusters: True positive, true negative, false positive, and false negative. This study shows that the user is able to improve her/his condition based on the explanation given by the robot. © 2020, MDPI AG. All rights reserved.;recommender;mismatch ;Bonomolo M., Ribino P., Vitale G.;2020
Explaining the Influence of Prior Knowledge on POMCP Policies;Partially Observable Monte Carlo Planning is a recently proposed online planning algorithm which makes use of Monte Carlo Tree Search to solve Partially Observable Monte Carlo Decision Processes. This solver is very successful because of its capability to scale to large uncertain environments, a very important property for current real-world planning problems. In this work we propose three main contributions related to POMCP usage and interpretability. First, we introduce a new planning problem related to mobile robot collision avoidance in paths with uncertain segment difficulties, and we show how POMCP performance in this context can take advantage of prior knowledge about segment difficulty relationships. This problem has direct real-world applications, such as, safety management in industrial environments where human-robot interaction is a crucial issue. Then, we present an experimental analysis about the relationships between prior knowledge provided to the algorithm and performance improvement, showing that in our case study prior knowledge affects two main properties, namely, the distance between the belief and the real state, and the mutual information between segment difficulty and action taken in the segment. This analysis aims to improve POMCP explainability, following the line of recently proposed eXplainable AI and, in particular, eXplainable planning. Finally, we analyze results on a synthetic case study and show how the proposed measures can improve the understanding about internal planning mechanisms. © 2020, Springer Nature Switzerland AG.;navigation;no us;Castellini A., Marchesini E., Mazzi G., Farinelli A.;2020
Explanation-Based Reward Coaching to Improve Human Performance via Reinforcement Learning;For robots to effectively collaborate with humans, it is critical to establish a shared mental model amongst teammates. In the case of incongruous models, catastrophic failures may occur unless mitigating steps are taken. To identify and remedy these potential issues, we propose a novel mechanism for enabling an autonomous system to detect model disparity between itself and a human collaborator, infer the source of the disagreement within the model, evaluate potential consequences of this error, and finally, provide human-interpretable feedback to encourage model correction. This process effectively enables a robot to provide a human with a policy update based on perceived model disparity, reducing the likelihood of costly or dangerous failures during joint task execution. This paper makes two contributions at the intersection of explainable AI (xAI) and human-robot collaboration: 1) The Reward Augmentation and Repair through Explanation (RARE) framework for estimating task understanding and 2) A human subjects study illustrating the effectiveness of reward augmentation-based policy repair in a complex collaborative task.;assistive task;mismatch, task complexity;Tabrez A,Agrawal S,Hayes B;2020
Human-agent Explainability: An experimental case study on the filtering of explanations;"The communication between robots/agents and humans is a challenge, since humans are typically not capable of understanding the agent’s state of mind. To overcome this challenge, this paper relies on recent advances in the domain of eXplainable Artificial Intelligence (XAI) to trace the decisions of the agents, increase the human’s understandability of the agents’ behavior, and hence improve efficiency and user satisfaction. In particular, we propose a Human-Agent EXplainability Architecture (HAEXA) to model human-agent explainability. HAEXA filters the explanations provided by the agents to the human user to reduce the user’s cognitive load. To evaluate HAEXA, a human-computer interaction experiment is conducted, where participants watch an agent-based simulation of aerial package delivery and fill in a questionnaire that collects their responses. The questionnaire is built according to XAI metrics as established in the literature. The significance of the results is verified using Mann-Whitney U tests. The results show that the explanations increase the understandability of the simulation by human users. However, too many details in the explanations overwhelm them; hence, in many scenarios, it is preferable to filter the explanations. Copyright © 2020 by SCITEPRESS – Science and Technology Publications, Lda. All rights reserved.";high-level dm, self monitoring ;unforeseen circumstances;Mualla Y., Tchappi I.H., Najjar A., Kampik T., Galland S., Nicolle C.;2020
Improving Human-Robot Interaction through Explainable Reinforcement Learning;Gathering the most informative data from humans without overloading them remains an active research area in AI, and is closely coupled with the problems of determining how and when information should be communicated to others [12]. Current decision support systems (DSS) are still overly simple and static, and cannot adapt to changing environments we expect to deploy in modern systems [3], [4], [9], [11]. They are intrinsically limited in their ability to explain rationale versus merely listing their future behaviors, limiting a human's understanding of the system [2], [7]. Most probabilistic assessments of a task are conveyed after the task/skill is attempted rather than before [10], [14], [16]. This limits failure recovery and danger avoidance mechanisms. Existing work on predicting failures relies on sensors to accurately detect explicitly annotated and learned failure modes [13]. As such, important non-obvious pieces of information for assessing appropriate trust and/or course-of-action (COA) evaluation in collaborative scenarios can go overlooked, while irrelevant information may instead be provided that increases clutter and mental workload. Understanding how AI models arrive at specific decisions is a key principle of trust [8]. Therefore, it is critically important to develop new strategies for anticipating, communicating, and explaining justifications and rationale for AI driven behaviors via contextually appropriate semantics.;assistive task;error ;Tabrez A,Hayes B;2020
Increasing user trust in a fetching robot using explainable AI in a traded control paradigm;Recently, there has been an increase use of collaborative robots in manufacturing, healthcare, military, and personal use scenarios. Such robots operate under shared or traded control paradigms with their human operators or users. Therefore, it is important to understand how to address and improve issues of trust between the humans and collaborative robots. In this paper, we investigate the impact of robotic agent transparency to their subjective trust level by a human operator. Several experiments were conceived with the help of a fetching mobile robot under traded control, and data such as subjective trust level was collected during experimentation. Results indicate that trust is easier to lose than it is to gain. Furthermore, results also indicate that agent transparency's effect on operator trust is more significant in tasks of increasing complexity. © 2020 ACM.;high-level dm;social;Cassady J.T., Robinson C., Popa D.O.;2020
Integrating Deep Learning and Non-monotonic Logical Reasoning for Explainable Visual Question Answering;Deep learning algorithms represent the state of the art for many problems in robotics and AI. However, they require a large labeled dataset, are computationally expensive, and the learned models are difficult to understand. Our architecture draws inspiration from research in cognitive systems to address these limitations. In the context of answering explanatory questions about scenes and an underlying classification task, our architecture uses non-monotonic logical reasoning with incomplete commonsense domain knowledge, and the features extracted from input images, to answer the input queries. Features from images not processed by such reasoning are mapped to the desired answers using a learned deep network model. In addition, previously unknown state constraints of the domain are learned incrementally and used for subsequent reasoning. Experimental results show that in comparison with an “end to end” deep architecture, our architecture significantly improves accuracy and efficiency of decision making. © 2020, Springer Nature Switzerland AG.;vision;no us;Sridharan M., Riley H.;2020
Joint Mind Modeling for Explanation Generation in Complex Human-Robot Collaborative Tasks;Human collaborators can effectively communicate with their partners to finish a common task by inferring each other’s mental states (e.g., goals, beliefs, and desires). Such mind-aware communication minimizes the discrepancy among collaborators’ mental states, and is crucial to the success in human ad-hoc teaming. We believe that robots collaborating with human users should demonstrate similar pedagogic behavior. Thus, in this paper, we propose a novel explainable AI (XAI) framework for achieving human-like communication in human-robot collaborations, where the robot builds a hierarchical mind model of the human user and generates explanations of its own mind as a form of communications based on its online Bayesian inference of the user’s mental state. To evaluate our framework, we conduct a user study on a real-time human-robot cooking task. Experimental results show that the generated explanations of our approach significantly improves the collaboration performance and user perception of the robot. Code and video demos are available on our project website: https://xfgao.github.io/xCookingWeb/.;assistive task, high-level dm;social;"X. Gao; R. Gong; Y. Zhao; S. Wang; T. Shu; S. -C. Zhu";2020
