Title;Abstract;Type;Cause;Authors;Year
"""What If It Is Wrong"": Effects of Power Dynamics and Trust Repair Strategy on Trust and Compliance in HRI";Robotic systems designed to work alongside people are susceptible to technical and unexpected errors. Prior work has investigated a variety of strategies aimed at repairing people's trust in the robot after its erroneous operations. In this work, we explore the effect of post-error trust repair strategies (promise and explanation) on people's trust in the robot under varying power dynamics (supervisor and subordinate robot). Our results show that, regardless of the power dynamics, promise is more effective at repairing user trust than explanation. Moreover, people found a supervisor robot with verbal trust repair to be more trustworthy than a subordinate robot with verbal trust repair. Our results further reveal that people are prone to complying with the supervisor robot even if it is wrong. We discuss the ethical concerns in the use of supervisor robot and potential interventions to prevent improper compliance in users for more productive human-robot collaboration.;high-level dm;error;Karli UB,Cao S,Huang CM;2023
A causal-based approach to explain, predict and prevent failures in robotic tasks;"Robots working in human environments need to adapt to unexpected changes to avoid failures. This is an open and complex challenge that requires robots to timely predict and identify the causes of failures in order to prevent them. In this paper, we present a causal-based method that will enable robots to predict when errors are likely to occur and prevent them from happening by executing a corrective action. Our proposed method is able to predict immediate failures and also failures that will occur in the future. The latter type of failure is very challenging, and we call them timely-shifted action failures (e.g., the current action was successful but will negatively affect the success of future actions). First, our method detects the cause–effect relationships between task executions and their consequences by learning a causal Bayesian network (BN). The obtained model is transferred from simulated data to real scenarios to demonstrate the robustness and generalization of the obtained models. Based on the causal BN, the robot can predict if and why the executed action will succeed or not in its current state. Then, we introduce a novel method that finds the closest success state through a contrastive Breadth-First-Search if the current action was predicted to fail. We evaluate our approach for the problem of stacking cubes in two cases; (a) single stacks (stacking one cube) and; (b) multiple stacks (stacking three cubes). In the single-stack case, our method was able to reduce the error rate by 97%. We also show that our approach can scale to capture various actions in one model, allowing us to measure the impact of an imprecise stack of the first cube on the stacking success of the third cube. For these complex situations, our model was able to prevent around 95% of the stacking errors. Thus, demonstrating that our method is able to explain, predict, and prevent execution failures, which even scales to complex scenarios that require an understanding of how the action history impacts future actions. © 2023 The Authors";self-monitoring;no us;Diehl M., Ramirez-Amaro K.;2023
A User Interface for Sense-making of the Reasoning Process while Interacting with Robots;This paper describes an interface that enables experts to communicate with a virtual robot in a simulated environment via natural language, and to visualize the robot's knowledge representation for them for inspection and correction. The interface visually links the robot's internal reasoning processes and knowledge with the simulated instances in the form of a 3D isometric visualization as well as the robot's first-person view. After 3 weeks of using the system by the roboticists in their daily development, some feedback was collected that provided insights for designing such systems in the future. © 2023 Owner/Author.;high-level dm, knowledge representation;debugging/improvement;Wang C., Deigmoeller J., An P., Eggert J.;2023
Abstracting Noisy Robot Programs;Abstraction is a commonly used process to represent some low-level system by a more coarse specification with the goal to omit unnecessary details while preserving important aspects. While recent work on abstraction in the situation calculus has focused on non-probabilistic domains, we describe an approach to abstraction of probabilistic and dynamic systems. Based on a variant of the situation calculus with probabilistic belief, we define a notion of bisimulation that allows to abstract a detailed probabilistic basic action theory with noisy actuators and sensors by a possibly non-stochastic basic action theory. By doing so, we obtain abstract Golog programs that omit unnecessary details and which can be translated back to a detailed program for actual execution. This simplifies the implementation of noisy robot programs, opens up the possibility of using non-stochastic reasoning methods (e.g., planning) on probabilistic problems, and provides domain descriptions that are more easily understandable and explainable.;knowledge representation;no us;Hofmann T,Belle V;2023
An explainable artificial intelligence approach to spatial navigation based on hippocampal circuitry;Learning to navigate a complex environment is not a difficult task for a mammal. For example, finding the correct way to exit a maze following a sequence of cues, does not need a long training session. Just a single or a few runs through a new environment is, in most cases, sufficient to learn an exit path starting from anywhere in the maze. This ability is in striking contrast with the well-known difficulty that any deep learning algorithm has in learning a trajectory through a sequence of objects. Being able to learn an arbitrarily long sequence of objects to reach a specific place could take, in general, prohibitively long training sessions. This is a clear indication that current artificial intelligence methods are essentially unable to capture the way in which a real brain implements a cognitive function. In previous work, we have proposed a proof-of-principle model demonstrating how, using hippocampal circuitry, it is possible to learn an arbitrary sequence of known objects in a single trial. We called this model SLT (Single Learning Trial). In the current work, we extend this model, which we will call e-STL, to introduce the capability of navigating a classic four-arms maze to learn, in a single trial, the correct path to reach an exit ignoring dead ends. We show the conditions under which the e-SLT network, including cells coding for places, head-direction, and objects, can robustly and efficiently implement a fundamental cognitive function. The results shed light on the possible circuit organization and operation of the hippocampus and may represent the building block of a new generation of artificial intelligence algorithms for spatial navigation. © 2023 The Author(s);navigation;no us;Coppolino S., Migliore M.;2023
An Inductive Logic Programming Approach for Entangled Tube Modeling in Bin Picking;Bin picking is a challenging problem that involves using a robotic manipulator to remove, one-by-one, a set of objects randomly stacked in a container. When the objects are prone to entanglement, having an estimation of their pose and shape is highly valuable for more reliable grasp and motion planning. This paper focuses on modeling entangled tubes with varying degrees of curvature. An unconventional machine learning technique, Inductive Logic Programming (ILP), is used to construct sets of rules (theories) capable of modeling multiple tubes when given the cylinders that constitute them. Datasets of entangled tubes are created via simulation in Gazebo. Experiments using Aleph and SWI-Prolog illustrate how ILP can build explainable theories with a high performance, using a relatively small dataset and low amount of time for training. Therefore, this work serves as a proof-of-concept that ILP is a valuable method to acquire knowledge and validate heuristics for pose and shape estimation in complex bin picking scenarios. © 2023, The Author(s), under exclusive license to Springer Nature Switzerland AG.;range/3d;no us;Leão G., Camacho R., Sousa A., Veiga G.;2023
Automated end-of-line quality assurance with visual inspection and convolutional neural networks;End-of-line (EOL) quality assurance of finished components has so far required additional manual inspections and burdened manufacturers with high labor costs. To automate the EOL process, in this paper a fully AI-based quality classification system is introduced. The components are automatically placed under the optical inspection system employing a robot. A Convolutional Neural Network (CNN) is used for the quality classification of the recorded images. After quality control, the component is sorted automatically in different bins depending on the quality control result. The trained CNN models achieve up to 98.7% accuracy on the test data. The classification performance of the CNN is compared with that of a rule-based approach. Additionally, the trained classification model is interpreted by an explainable AI method to make it comprehensible for humans and reassure them about its trustworthiness. This work originated from an actual industrial use case from Witzenmann GmbH. Together with the company, a demonstrator was realized. © 2023 Walter de Gruyter GmbH, Berlin/Boston.;vision;no us;Kim H., Frommknecht A., Bieberstein B., Stahl J., Huber M.F.;2023
Communicating Missing Causal Information to Explain a Robot’s Past Behavior;Robots need to explain their behavior to gain trust. Existing research has focused on explaining a robot’s current behavior, yet it remains unknown yet challenging how to provide explanations of past actions in an environment that might change after a robot’s actions, leading to critical missing causal information due to moved objects.We conducted an experiment (N = 665) investigating how a robot could help participants infer the missing causal information by replaying the past behavior physically, using verbal explanations, and projecting visual information onto the environment. Participants watched videos of the robot replaying its completion of an integrated mobile kitting task. During the replay, the objects are already gone, so participants needed to infer where an object was picked, where a ground obstacle had been, and where the object was placed.Based on the results, we recommend combining physical replay with speech and projection indicators (Replay-Project-Say) to help infer all the missing causal information (picking, navigation, and placement) from the robot’s past actions. This condition had the best outcome in both task-based—effectiveness, efficiency, and confidence—and team-based metrics—workload and trust. If one’s focus is efficiency, then we recommend projection markers for navigation inferences and verbal markers for placing inferences.;high-level dm, navigation;incomplete;Han Z,Yanco H;2023
COMPASS: a formal framework and aggregate dataset for generalized surgical procedure modeling;Purpose: We propose a formal framework for the modeling and segmentation of minimally invasive surgical tasks using a unified set of motion primitives (MPs) to enable more objective labeling and the aggregation of different datasets. Methods: We model dry-lab surgical tasks as finite state machines, representing how the execution of MPs as the basic surgical actions results in the change of surgical context, which characterizes the physical interactions among tools and objects in the surgical environment. We develop methods for labeling surgical context based on video data and for automatic translation of context to MP labels. We then use our framework to create the COntext and Motion Primitive Aggregate Surgical Set (COMPASS), including six dry-lab surgical tasks from three publicly available datasets (JIGSAWS, DESK, and ROSMA), with kinematic and video data and context and MP labels. Results: Our context labeling method achieves near-perfect agreement between consensus labels from crowd-sourcing and expert surgeons. Segmentation of tasks to MPs results in the creation of the COMPASS dataset that nearly triples the amount of data for modeling and analysis and enables the generation of separate transcripts for the left and right tools. Conclusion: The proposed framework results in high quality labeling of surgical data based on context and fine-grained MPs. Modeling surgical tasks with MPs enables the aggregation of different datasets and the separate analysis of left and right hands for bimanual coordination assessment. Our formal framework and aggregate dataset can support the development of explainable and multi-granularity models for improved surgical process analysis, skill assessment, error detection, and autonomy. © 2023, CARS.;vision;not applicable;Hutchinson K., Reyes I., Li Z., Alemzadeh H.;2023
Enhancing representational learning for cloud robotic vision through explainable fuzzy convolutional autoencoder framework;Robot vision is one of the most recent developments in robotics and automation technology. Owing to machine vision systems that integrate image processing and deep learning, robots could now operate faster on the assembly line and in new contexts such as supermarkets, hospitals, and restaurants. The key driver for such systems is the advancement of machine vision systems. Robotic vision is mainly composed of programs, cameras, and any other technology that assists robots in developing visual insights. This enables robots to do sophisticated visual tasks, such as a robot arm trained to pick up an object. The conventional algorithms employ semantic segmentation from camera images. Reconstructing a real-time environment from two or more images entails creating a 3D model of the scene require expensive labeled data to train visual semantic segmentation. These 3D models can be anything from fragments of a 3D point cloud to 3D surface models produced using advanced techniques. In order to extract several images into 3D models or subsets of a raw point cloud, enhanced representation learning is necessary. Inspired by the recent achievements of machine vision and deep learning, this paper proposes a deep representation learning technique for enhanced feature recognition learning based on explainable convolutional autoencoder that can be employed for feature classifier level using fuzzy clustering and further facilitated the human decision making of data, which requires for the representation of robot data that allow for swift and precise observations. © 2023, The Author(s), under exclusive licence to Springer-Verlag GmbH Germany, part of Springer Nature.;range/3d;no us;Udendhran R., Yamini G., Badrinath N., Jegathesh Amalraj J., Suresh A.;2023
Explainable human activity recognition based on probabilistic spatial partitions for symbiotic workplaces;In recent years, smart workplaces that adapt to human activity and motion behavior have been proposed for cognitive production systems. In this respect, methods for identifying the feelings and activities of human workers are being investigated to improve the cognitive capability of smart machines such as robots in shared working spaces. Recognizing human activities and predicting the possible next sequence of operations may simplify robot programming and improve collaboration efficiency. However, human activity recognition still requires explainable models that are versatile, robust, and interpretative. Therefore, recognizing and analyzing human action details using continuous probability density estimates in different workplace layouts is essential. Three scenarios are considered: a standalone, a one-piece flow U-form, and a human-robot hybrid workplace. This work presents a novel approach to human activity recognition based on a probabilistic spatial partition (HAROPP). Its performance is compared to the geometric-bounded activity recognition method. Results show that spatial partitions based on probabilistic density contain 20% fewer data frames and 10% more spatial areas than the geometric bounding box. The approach, on average, detects human activities correctly for 81% of the cases for a pre-known workplace layout. HAROPP has scalability and applicability potential for cognitive workplaces with a digital twin in the loop for pushing the cognitive capabilities of machine systems and realizing human-centered environments. © 2023 Informa UK Limited, trading as Taylor & Francis Group.;user modelling, vision;no us;Tuli T.B., Manns M.;2023
Explainable Human-Robot Training and Cooperation with Augmented Reality;The current spread of social and assistive robotics applications is increasingly highlighting the need for robots that can be easily taught and interacted with, even by users with no technical background. Still, it is often difficult to grasp what such robots know or to assess if a correct representation of the task is being formed. Augmented Reality (AR) has the potential to bridge this gap. We demonstrate three use cases where AR design elements enhance the explainability and efficiency of human-robot interaction: 1) a human teaching a robot some simple kitchen tasks by demonstration, 2) the robot showing its plan for solving novel tasks in AR to a human for validation, and 3) a robot communicating its intentions via AR while assisting people with limited mobility during daily activities. © 2023 Owner/Author.;vision, high-level dm, user modelling ;no us;Wang C., Belardinelli A., Hasler S., Stouraitis T., Tanneberg D., Gienger M.;2023
Geometry-guided multilevel RGBD fusion for surface normal estimation;Developments in 3D computer vision have advanced scene understanding and 3D modeling. Surface normal estimation is a basic task in these fields. In this paper, we propose a geometry-guided multilevel fusion scheme for high-quality surface normal estimation by exploiting texture and geometry information from color and depth images. The surface normal is progressively predicted with a coarse-to-fine strategy. First, an initial surface normal (IniNormal) Nini is predicted by a hierarchical confidence reweighting convolution neural network to merge texture and geometry information in a CNN feature level. Although a general accuracy is achieved, the long tail problem makes the IniNormal always fails in special areas where the depth map is high-quality while the intensity interference is challenging, such as repeating textures and abnormal exposures. Further, a traditional geometry-consistent based surface normal(GeoNormal) Ngeo is calculated based on traditional constraints, and a surface normal level fusion module is designed to remap the depth to different representations and reconsider scene information. Then, the final clear surface normal N is estimated by adaptively reintegrating the IniNormal and GeoNormal in a decision level. To overcome disturbances in the dataset and ensure the trainability of the network, a carefully designed hybrid objective function and an annealed term are applied. An explainable analysis is attached. The experimental results on two benchmark datasets demonstrate that the proposed GMLF(geometry-guided multilevel RGBD fusion for surface normal estimation) can achieve better quantitative and qualitative performance. The proposed method may be useful for robots and auto-driving which can be applied in the next-generation Internet-of-Things (NG-IoT). © 2023 Elsevier B.V.;range/3d;no us;Tong Y., Chen J., Wang Y.;2023
Grape Maturity Estimation for Personalized Agrobot Harvest by Fuzzy Lattice Reasoning (FLR) on an Ontology of Constraints;Sustainable agricultural production, under the current world population explosion, calls for agricultural robot operations that are personalized, i.e., locally adjusted, rather than en masse. This work proposes implementing such operations based on logic in order to ensure that a reasonable operation is applied locally. In particular, the interest here is in grape harvesting, where a binary decision has to be taken regarding the maturity of a grape in order to harvest it or not. A Boolean lattice ontology of inequalities is considered regarding three grape maturity indices. Then, the established fuzzy lattice reasoning (FLR) is applied by the FLRule method. Comparative experimental results on real-world data demonstrate a good maturity prediction. Other advantages of the proposed method include being parametrically tunable, as well as exhibiting explainable decision-making with either crisp or ambiguous input measurements. New mathematical results are also presented. © 2023 by the authors.;high-level dm;no us;Lytridis C., Siavalas G., Pachidis T., Theocharis S., Moschou E., Kaburlasos V.G.;2023
Interactive Policy Shaping for Human-Robot Collaboration with Transparent Matrix Overlays;One important aspect of effective human--robot collaborations is the ability for robots to adapt quickly to the needs of humans. While techniques like deep reinforcement learning have demonstrated success as sophisticated tools for learning robot policies, the fluency of human-robot collaborations is often limited by these policies' inability to integrate changes to a user's preferences for the task. To address these shortcomings, we propose a novel approach that can modify learned policies at execution time via symbolic if-this-then-that rules corresponding to a modular and superimposable set of low-level constraints on the robot's policy. These rules, which we call Transparent Matrix Overlays, function not only as succinct and explainable descriptions of the robot's current strategy but also as an interface by which a human collaborator can easily alter a robot's policy via verbal commands. We demonstrate the efficacy of this approach on a series of proof-of-concept cooking tasks performed in simulation and on a physical robot.;high-level dm;no us;Brawer J,Ghose D,Candon K,Qin M,Roncone A,Vázquez M,Scassellati B;2023
Model tree methods for explaining deep reinforcement learning agents in real-time robotic applications;Deep reinforcement learning has shown useful in the field of robotics but the black-box nature of deep neural networks impedes the applicability of deep reinforcement learning agents for real-world tasks. This is addressed in the field of explainable artificial intelligence, by developing explanation methods that aim to explain such agents to humans. Model trees as surrogate models have proven useful for producing explanations for black-box models used in real-world robotic applications, in particular, due to their capability of providing explanations in real time. In this paper, we provide an overview and analysis of available methods for building model trees for explaining deep reinforcement learning agents solving robotics tasks. We find that multiple outputs are important for the model to be able to grasp the dependencies of coupled output features, i.e. actions. Additionally, our results indicate that introducing domain knowledge via a hierarchy among the input features during the building process results in higher accuracies and a faster building process. © 2022 The Author(s);navigation;no us;Gjærum V.B., Strümke I., Løver J., Miller T., Lekkas A.M.;2023
Morse Graphs: Topological Tools for Analyzing the Global Dynamics of Robot Controllers;Understanding the global dynamics of a robot controller, such as identifying attractors and their regions of attraction (RoA), is important for safe deployment and synthesizing more effective hybrid controllers. This paper proposes a topological framework to analyze the global dynamics of robot controllers, even data-driven ones, in an effective and explainable way. It builds a combinatorial representation representing the underlying system’s state space and non-linear dynamics, which is summarized in a directed acyclic graph, the Morse graph. The approach only probes the dynamics locally by forward propagating short trajectories over a state-space discretization, which needs to be a Lipschitz-continuous function. The framework is evaluated given either numerical or data-driven controllers for classical robotic benchmarks. It is compared against established analytical and recent machine learning alternatives for estimating the RoAs of such controllers. It is shown to outperform them in accuracy and efficiency. It also provides deeper insights as it describes the global dynamics up to the discretization’s resolution. This allows to use the Morse graph to identify how to synthesize controllers to form improved hybrid solutions or how to identify the physical limitations of a robotic system. © 2023, The Author(s), under exclusive license to Springer Nature Switzerland AG.;joint motion ;no us;Vieira E.R., Granados E., Sivaramakrishnan A., Gameiro M., Mischaikow K., Bekris K.E.;2023
