Title;Abstract;Type;Cause;Authors;Year
AutoPreview: A Framework for Autopilot Behavior Understanding;The behavior of self-driving cars may differ from people's expectations (e.g. an autopilot may unexpectedly relinquish control). This expectation mismatch can cause potential and existing users to distrust self-driving technology and can increase the likelihood of accidents. We propose a simple but effective framework, AutoPreview, to enable consumers to preview a target autopilot's potential actions in the real-world driving context before deployment. For a given target autopilot, we design a delegate policy that replicates the target autopilot behavior with explainable action representations, which can then be queried online for comparison and to build an accurate mental model. To demonstrate its practicality, we present a prototype of AutoPreview integrated with the CARLA simulator along with two potential use cases of the framework. We conduct a pilot study to investigate whether or not AutoPreview provides deeper understanding about autopilot behavior when experiencing a new autopilot policy for the first time. Our results suggest that the AutoPreview method helps users understand autopilot behavior in terms of driving style comprehension, deployment preference, and exact action timing prediction. © 2021 ACM.;high-level dm;incomplete, mismatch;Shen Y., Wijayaratne N., Du P., Jiang S., Driggs-Campbell K.;2021
Building the Foundation of Robot Explanation Generation Using Behavior Trees;As autonomous robots continue to be deployed near people, robots need to be able to explain their actions. In this article, we focus on organizing and representing complex tasks in a way that makes them readily explainable. Many actions consist of sub-actions, each of which may have several sub-actions of their own, and the robot must be able to represent these complex actions before it can explain them. To generate explanations for robot behavior, we propose using Behavior Trees (BTs), which are a powerful and rich tool for robot task specification and execution. However, for BTs to be used for robot explanations, their free-form, static structure must be adapted. In this work, we add structure to previously free-form BTs by framing them as a set of semantic sets goal, subgoals, steps, actions and subsequently build explanation generation algorithms that answer questions seeking causal information about robot behavior. We make BTs less static with an algorithm that inserts a subgoal that satisfies all dependencies. We evaluate our BTs for robot explanation generation in two domains: a kitting task to assemble a gearbox, and a taxi simulation. Code for the behavior trees (in XML) and all the algorithms is available at github.com/uml-robotics/robot-explanation-BTs.;high-level dm;no us;Han Z,Giger D,Allspaw J,Lee MS,Admoni H,Yanco HA;2021
Can i Pour into It? Robot Imagining Open Containability Affordance of Previously Unseen Objects via Physical Simulations;Open containers, i.e., containers without covers, are an important and ubiquitous class of objects in human life. In this letter, we propose a novel method for robots to 'imagine' the open containability affordance of a previously unseen object via physical simulations. The robot autonomously scans the object with an RGB-D camera. The scanned 3D model is used for open containability imagination which quantifies the open containability affordance by physically simulating dropping particles onto the object and counting how many particles are retained in it. This quantification is used for open-container vs. non-open-container binary classification (hereafter referred to as open container classification). If the object is classified as an open container, the robot further imagines pouring into the object, again using physical simulations, to obtain the pouring position and orientation for real robot autonomous pouring. We evaluate our method on open container classification and autonomous pouring of granular material on a dataset containing 130 previously unseen objects with 57 object categories. Although our proposed method uses only 11 objects for simulation calibration, its open container classification aligns well with human judgements. In addition, our method endows the robot with the capability to autonomously pour into the 55 containers in the dataset with a very high success rate. We also compare to a deep learning method. Results show that our method achieves the same performance as the deep learning method on open container classification and outperforms it on autonomous pouring. Moreover, our method is fully explainable. © 2016 IEEE.;range/3d;no us;Wu H., Chirikjian G.S.;2021
Chatbot as Islamic Finance Expert (CaIFE): When Finance Meets Artificial Intelligence;Artificial intelligence (AI) is the key technology in the new disruptive technological innovation and industrial transformation. AI has very wide application in finance and banking. The financial institutions not only answer the queries of the customers, but they should also clarify the complaints the customer face and provide the solution. For this purpose, many banks and financial institutions are using Chatbot to provide solution to customer complaints and queries. Chatbots are very efficient in providing solution to customers queries and are available 24 hours to give solution to customer's complaints. Finally, we propose an artificial Intelligence based interactive Chatbot called 'Chatbot as Islamic Finance Expert' (CaIFE). Our interactive Chatbot CaIFE receives automatic robot support related to Islamic finance and banking by having users communicate with a robot having knowledge accumulated by machine learning. It answers any query related to Islamic finance and banking on real time basis. It then presents a case study of CaIFE and explains its characteristics and limitations.;assistive general;no us;Khan S,Rabbani MR;2021
Co-Training an Observer and an Evading Target;Reinforcement learning (RL) is already widely applied to applications such as robotics, but it is only sparsely used in sensor management. In this paper, we apply the popular Proximal Policy Optimization (PPO) approach to a multi-agent UAV tracking scenario. While recorded data of real scenarios can accurately reflect the real world, the required amount of data is not always available. Simulation data, however, is typically cheap to generate, but the utilized target behavior is often naive and only vaguely represents the real world. In this paper, we utilize multi-agent RL to jointly generate protagonistic and antagonistic policies and overcome the data generation problem, as the policies are generated on-the-fly and adapt continuously. This way, we are able to clearly outperform baseline methods and robustly generate competitive policies. In addition, we investigate explainable artificial intelligence (XAI) by interpreting feature saliency and generating an easy-to-read decision tree as a simplified policy.;navigation;no us;"A. Brandenburger; F. Hoffmann; A. Charlish";2021
Cognitive architecture for intuitive and interactive task learning in industrial collaborative robotics;This paper introduces a cognitive architecture, implemented in python3, designed with industrial collaborative robotics specifications in mind, to engage in a mixed-initiative teacher/learner setting called interactive task learning: a human can teach the robot, with natural and multimodal communication means, how to perform a task. The architecture has been built around explainable, modular representations (relational graphs and behavior trees) to ease the upgradability of the system and AI modules to adapt to realistic and complex settings. A first prototype based on speech and gesture communication means is proposed and has been validated on an industrial system to learn an unknown task. A link to a video of this validation is attached in the article. © 2021 ACM.;high-level dm, knowledge representation;no us;Helenon F., Thiery S., Nyiri E., Gibaru O.;2021
Connecting Semantic Building Information Models and Robotics: An application to 2D LiDAR-based localization;This paper proposes a method to integrate the rich semantic data-set provided by Building Information Modeling (BIM) with robotics world models, taking as use case indoor semantic localization in a large university building. We convert a subset of semantic entities with associated geometry present in BIM models and represented in the Industry Foundation Classes (IFC) data format to a robot-specific world model representation. This representation is then stored in a spatial database from which the robot can query semantic objects in its immediate surroundings. The contribution of this work is that, from this query, the robot’s feature detectors are configured and used to make explicit data associations with semantic structural objects from the BIM model that are located near the robot’s current position. A graph-based approach is then used to localize the robot, incorporating the explicit map-feature associations for localization. We show that this explainable model-based approach allows a robot equipped with a 2D LiDAR and odometry to track its pose in a large indoor environment for which a BIM model is available.;navigation;no us;"R. W. M. Hendrikx; P. Pauwels; E. Torta; H. P. J. Bruyninckx; M. J. G. van de Molengraft";2021
Developing Interpretable Machine Learning for Forward Kinematics of Robotic Arms;Machine learning (ML) is becoming increasingly sought after in diverse domains. Unfortunately for this objective, most ML research has focused on improving performance on evaluation metrics such as accuracy. However, to make important decisions, ML models need to be interpretable. We propose an approach to approximate kinematics of a robotic arm using interpretable artificial neural networks (ANNs). This work is based on approximating nonlinear functions where domain knowledge and visually observable features of the data are used to design ANNs. After analyzing existing work, we present a feasibility study approximating the kinematics of a simplified robotic arm and extend the work to multiple hidden layers. We generalize the existing work and extend its use for a different application, noting the challenges that arise while extending this work to multiple hidden layers.;joint motion ;no us;"S. T. Kanneganti; J. Pei; D. F. Hougen";2021
ELVIRA: An explainable agent for value and utility-driven multiuser privacy;Online social networks fail to support users to adequately share co-owned content, which leads to privacy violations. Scholars proposed collaborative mechanisms to support users, but they did not satisfy one or more requirements needed according to empirical evidence in this domain, such as explainability, role-agnosticism, adaptability, and being utility- and value-driven. We present ELVIRA, an agent that supports multiuser privacy, whose design meets all these requirements. By considering the sharing preferences and the moral values of users, ELVIRA identifies the optimal sharing policy. Furthermore, ELVIRA justifies the optimality of the solution through explanations based on argumentation. We prove via simulations that ELVIRA provides solutions with the best trade-off between individual utility and value adherence. We also show through a user study that ELVIRA suggests solutions that are more acceptable than existing approaches and that its explanations are also more satisfactory. © 2021 International Foundation for Autonomous Agents and Multiagent Systems (www.ifaamas.org). All rights reserved.;recommender;social;Mosca F., Such J.M.;2021
Explainable AI for robot failures: Generating explanations that improve user assistance in fault recovery;With the growing capabilities of intelligent systems, the integration of robots in our everyday life is increasing. However, when interact-ing in such complex human environments, the occasional failure of robotic systems is inevitable. The feld of explainable AI has sought to make complex-decision making systems more interpretable but most existing techniques target domain experts. On the contrary, in many failure cases, robots will require recovery assistance from non-expert users. In this work, we introduce a new type of explana-tion, Eerr , that explains the cause of an unexpected failure duringan agent's plan execution to non-experts. In order for Eerr to bemeaningful, we investigate what types of information within a set of hand-scripted explanations are most helpful to non-experts for failure and solution identifcation. Additionally, we investigate how such explanations can be autonomously generated, extending an ex-isting encoder-decoder model, and generalized across environments. We investigate such questions in the context of a robot performing a pick-and-place manipulation task in the home environment. Our results show that explanations capturing the context of a failure andhistory of past actions, are the most efective for failure and solutionidentifcation among non-experts. Furthermore, through a second user evaluation, we verify that our model-generated explanations can generalize to an unseen ofce environment, and are just as efective as the hand-scripted explanations. © 2021 IEEE Computer Society. All rights reserved.;navigation, vision, joint motion;error, inability, debugging/improvement;Das D., Banerjee S., Chernova S.;2021
EXPLAINABLE ARTIFICIAL INTELLIGENCE FOR ROBOT ARM CONTROL;In this paper, we investigate reinforcement learning model explainability through a pick and place task. Two robots with three degrees of freedom learned to solve the pick and place task in simulation as well as reality. To investigate the explanatory factors implicitly learned by the models, we derive robot parameters, i.e., the length of the robot segments. To overcome the black box nature of reinforcement learning models and provide a physical explanation of the results, the robot dimensions are derived from the learned reinforcement learning model and compared to the real dimensions. The hypothesis in the presented work is that converged reinforcement learning models must learn the robot parameters implicitly in order to learn a task. This transforms black box models into white box models, where each model’s decisions can be interpreted. Our experiments show that robot parameters can be derived from learned models and that the chosen reinforcement learning model implicitly learns physical context. In order to create robust and trustworthy AI systems for intelligent factories, we suggest that a physical interpretation of all black box models must be done. © 2021 Danube Adria Association for Automation and Manufacturing, DAAAM. All rights reserved.;joint motion ;no us;Schwaiger S., Aburaia M., Aburaia A., Woeber W.;2021
Explainable Reinforcement Learning for Human-Robot Collaboration;"Reinforcement learning (RL) is getting popular in the robotics field due to its nature to learn from dynamic environments. However, it is unable to provide explanations of why an output was generated. Explainability becomes therefore important in situations where humans interact with robots, such as in human-robot collaboration (HRC) scenarios. Attempts to address explainability in robotics usually are restricted to explain a specific decision taken by the RL model, but not to understand the complete behavior of the robot. In addition, the explainability methods are restricted to be used by domain experts as queries and responses are not translated to natural language. This work overcomes these limitations by proposing an explainability solution for RL models applied to HRC. It is mainly formed by the adaptation of two methods: (i) Reward decomposition gives an insight into the factors that impacted the robot's choice by decomposing the reward function. It further provides sets of relevant reasons for each decision taken during the robot's operation; (ii) Autonomous policy explanation provides a global explanation of the robot's behavior by answering queries in the form of natural language, thus making understandable to any human user. Experiments in simulated HRC scenarios revealed an increased understanding of the optimal choices made by the robots. Additionally, our solution demonstrated as a powerful debugging tool to find weaknesses in the robot's policy and assist in its improvement.";navigation;no us;"A. Iucci; A. Hata; A. Terra; R. Inam; I. Leite";2021
Explainable robotic systems: understanding goal-driven actions in a reinforcement learning scenario;Robotic systems are more present in our society everyday. In human–robot environments, it is crucial that end-users may correctly understand their robotic team-partners, in order to collaboratively complete a task. To increase action understanding, users demand more explainability about the decisions by the robot in particular situations. Recently, explainable robotic systems have emerged as an alternative focused not only on completing a task satisfactorily, but also on justifying, in a human-like manner, the reasons that lead to making a decision. In reinforcement learning scenarios, a great effort has been focused on providing explanations using data-driven approaches, particularly from the visual input modality in deep learning-based systems. In this work, we focus rather on the decision-making process of reinforcement learning agents performing a task in a robotic scenario. Experimental results are obtained using 3 different set-ups, namely, a deterministic navigation task, a stochastic navigation task, and a continuous visual-based sorting object task. As a way to explain the goal-driven robot’s actions, we use the probability of success computed by three different proposed approaches: memory-based, learning-based, and introspection-based. The difference between these approaches is the amount of memory required to compute or estimate the probability of success as well as the kind of reinforcement learning representation where they could be used. In this regard, we use the memory-based approach as a baseline since it is obtained directly from the agent’s observations. When comparing the learning-based and the introspection-based approaches to this baseline, both are found to be suitable alternatives to compute the probability of success, obtaining high levels of similarity when compared using both the Pearson’s correlation and the mean squared error. © 2021, The Author(s), under exclusive licence to Springer-Verlag London Ltd., part of Springer Nature.;high-level dm, navigation;no us;Cruz F., Dazeley R., Vamplew P., Moreira I.;2021
Explaining a deep reinforcement learning docking agent using linear model trees with user adapted visualization;Deep neural networks (DNNs) can be useful within the marine robotics field, but their utility value is restricted by their black-box nature. Explainable artificial intelligence methods attempt to understand how such black-boxes make their decisions. In this work, linear model trees (LMTs) are used to approximate the DNN controlling an autonomous surface vessel (ASV) in a simulated environment and then run in parallel with the DNN to give explanations in the form of feature attributions in real-time. How well a model can be understood depends not only on the explanation itself, but also on how well it is presented and adapted to the receiver of said explanation. Different end-users may need both different types of explanations, as well as different representations of these. The main contributions of this work are (1) significantly improving both the accuracy and the build time of a greedy approach for building LMTs by introducing ordering of features in the splitting of the tree, (2) giving an overview of the characteristics of the seafarer/operator and the developer as two different end-users of the agent and receiver of the explanations, and (3) suggesting a visualization of the docking agent, the environment, and the feature attributions given by the LMT for when the developer is the end-user of the system, and another visualization for when the seafarer or operator is the end-user, based on their different characteristics. © 2021 by the authors. Licensee MDPI, Basel, Switzerland.;navigation;no us;Gjærum V.B., Strümke I., Alsos O.A., Lekkas A.M.;2021
Explaining Before or After Acting? How the Timing of Self-Explanations Affects User Perception of Robot Behavior;Explanations are a useful tool to improve human-robot interaction and the topic of what a good explanation should entail has received much attention. While a robot’s behavior can be justified upon request after its execution, the intention to act can also be signaled by a robot prior to the execution. In this paper we report results from a pre-registered study on the effects of a social robot proactively giving a self-explanation before vs. after the execution of an undesirable behavior. Contrary to our expectations we found that explaining a behavior before its execution did not yield positive effects on the users’ perception of the robot or the behavior. Instead, the robot’s behavior was perceived as less desirable when explained before the execution rather than afterwards. Exploratory analyses further revealed that even though participants felt less uncertain about what was going to happen next, they also felt less in control, had lower trust and lower contact intentions with a robot that explained before it acted. © 2021, Springer Nature Switzerland AG.;high-level dm;social;Stange S., Kopp S.;2021
Explaining in Time: Meeting Interactive Standards of Explanation for Robotic Systems;Explainability has emerged as a critical AI research objective, but the breadth of proposed methods and application domains suggest that criteria for explanation vary greatly. In particular, what counts as a good explanation, and what kinds of explanation are computationally feasible, has become trickier in light of oqaque “black box” systems such as deep neural networks. Explanation in such cases has drifted from what many philosophers stipulated as having to involve deductive and causal principles to mere “interpretation,” which approximates what happened in the target system to varying degrees. However, such post hoc constructed rationalizations are highly problematic for social robots that operate interactively in spaces shared with humans. For in such social contexts, explanations of behavior, and, in particular, justifications for violations of expected behavior, should make reference to socially accepted principles and norms. In this article, we show how a social robot’s actions can face explanatory demands for how it came to act on its decision, what goals, tasks, or purposes its design had those actions pursue and what norms or social constraints the system recognizes in the course of its action. As a result, we argue that explanations for social robots will need to be accurate representations of the system’s operation along causal, purposive, and justificatory lines. These explanations will need to generate appropriate references to principles and norms—explanations based on mere “interpretability” will ultimately fail to connect the robot’s behaviors to its appropriate determinants. We then lay out the foundations for a cognitive robotic architecture for HRI, together with particular component algorithms, for generating explanations and engaging in justificatory dialogues with human interactants. Such explanations track the robot’s actual decision-making and behavior, which themselves are determined by normative principles the robot can describe and use for justifications.;high-level dm;no us;Arnold T,Kasenberg D,Scheutz M;2021
Flexible and explainable solutions for multi-agent path finding problems;The multi-agent path finding (MAPF) problem is a combinatorial search problem that aims at finding paths for multiple agents (e.g., robots) in an environment (e.g., an autonomous warehouse) such that no two agents collide with each other, and subject to some constraints on the lengths of paths. The real-world applications of MAPF require flexibility (e.g., solving variations of MAPF) as well as explainability. In this study, both of these challenges are addressed and some flexible and explainable solutions for MAPF and its variants are introduced. © A. Bogatarkan This work is licensed under the Creative Commons Attribution License.;navigation;no us;Bogatarkan A.;2021
Givenness Hierarchy Theoretic Referential Choice in Situated Contexts;We present a computational cognitive model of referential choice that models and explains the choice between a wide variety of referring forms using a small set of features important to situated contexts. By combining explainable machine learning techniques, data collected in situated contexts, and recent computational models of cognitive status, we produce an accurate and explainable model of referential choice that provides an intuitive pragmatic account of this process in humans, and an intuitive method for computationally enabling this capability in robots and other autonomous agents. © Cognitive Science Society: Comparative Cognition: Animal Minds, CogSci 2021.All rights reserved.;word choice;no us;Pal P., Clark G., Williams T.;2021
