Title;Abstract;Type;Cause;Authors;Year
Explain yourself! Effects of Explanations in Human-Robot Interaction;Recent developments in explainable artificial intelligence promise the potential to transform human-robot interaction: Explanations of robot decisions could affect user perceptions, justify their reliability, and increase trust. However, the effects on human perceptions of robots that explain their decisions have not been studied thoroughly. To analyze the effect of explainable robots, we conduct a study in which two simulated robots play a competitive board game. While one robot explains its moves, the other robot only announces them. Providing explanations for its actions was not sufficient to change the perceived competence, intelligence, likeability or safety ratings of the robot. However, the results show that the robot that explains its moves is perceived as more lively and human-like. This study demonstrates the need for and potential of explainable human-robot interaction and the wider assessment of its effects as a novel research direction.;high-level dm;social;"J. Ambsdorf; A. Munir; Y. Wei; K. Degkwitz; H. M. Harms; S. Stannek; K. Ahrens; D. Becker; E. Strahl; T. Weber; S. Wermter";2022
Explainability in Multi-Agent Path/Motion Planning: User-Study-Driven Taxonomy and Requirements;Multi-Agent Path Finding (MAPF) and Multi-Robot Motion Planning (MRMP) are complex problems to solve, analyze and build algorithms for. Automatically-generated explanations of algorithm output, by improving human understanding of the underlying problems and algorithms, could thus lead to better user experience, developer knowledge, and MAPF/MRMP algorithm designs. Explanations are contextual, however, and thus developers need a good understanding of the questions that can be asked about algorithm output, the kinds of explanations that exist, and the potential users and uses of explanations in MAPF/MRMP applications. In this paper we provide a first step towards establishing a taxonomy of explanations, and a list of requirements for the development of explainable MAPF/MRMP planners. We use interviews and a questionnaire with expert developers and industry practitioners to identify the kinds of questions, explanations, users, uses, and requirements of explanations that should be considered in the design of such explainable planners. Our insights cover a diverse set of applications: warehouse automation, computer games, and mining.;navigation;incomplete, suboptimal, ;Brandao M,Mansouri M,Mohammed A,Luff P,Coles A;2022
Explainable AI for Security of Human-Interactive Robots;This article considers the ways that explainable AI can be used to help secure human-interactive robots. To do so, we acknowledge that robots interact with a variety of people. For example, some people may operate robots that perform tasks in their homes or offices, while other people may be tasked with defending robots from potential attackers. We describe how explainable AI can be used to help the human operators of robots appropriately calibrate the trust they have in their systems, and we demonstrate this through an implementation. We also describe a novel generalizable human-in-the-loop framework based on control loops to characterize and explain attacks on robots to a robot defender. We explore the utility of such a framework through an analysis of its application in the incident management process, applied to robots. This framework allows formal definition of explainability, and the necessary condition for explainability in robots. The overarching goal of this article is to introduce the application of explainability for security of robotics as a novel area of research, therefore, we also discuss several open research problems we uncovered while applying explainable AI to security of robots. © 2022 The MITRE Corporation.;high-level dm, vision;no us;Roque A., Damodaran S.K.;2022
Explainable Hierarchical Imitation Learning for Robotic Drink Pouring;To accurately pour drinks into various containers is an essential skill for service robots. However, drink pouring is a dynamic process and difficult to model. Traditional deep imitation learning techniques for implementing autonomous robotic pouring have an inherent black-box effect and require a large amount of demonstration data for model training. To address these issues, an Explainable Hierarchical Imitation Learning (EHIL) method is proposed in this paper such that a robot can learn high-level general knowledge and execute low-level actions across multiple drink pouring scenarios. Moreover, with the EHIL method, a logical graph can be constructed for task execution, through which the decision-making process for action generation can be made explainable to users and the causes of failure can be traced out. Based on the logical graph, the framework is manipulable to achieve different targets while the adaptability to unseen scenarios can be achieved in an explainable manner. A series of experiments have been conducted to verify the effectiveness of the proposed method. Results indicate that EHIL outperforms the traditional behavior cloning method in terms of success rate, adaptability, manipulability, and explainability. Note to Practitioners—Pouring liquids is a common activity in people’s daily lives and all wet-lab industries. Drink pouring dynamic control is difficult to model, while the accurate perception of flow is challenging. To enable the robot to learn under unknown dynamics via observing the human demonstration, deep imitation learning can be used. To address the limitations of traditional deep neural networks, an Explainable Hierarchical Imitation Learning (EHIL) method is proposed in this paper. The proposed method enables the robot to learn a sequence of reasonable pouring phases for performing the task rather than simply execute the task via traditional behavior cloning. In this way, explainability and safety can be ensured. Manipulability can be achieved by reconstructing the logical graph. The target of this research is to obtain pouring dynamics via the learning method and realize the precise and quick pouring of drink from the source containers to various targeted containers with reliable performance, adaptability, manipulability, and explainability.;high-level dm, vision;no us ;"D. Zhang; Q. Li; Y. Zheng; L. Wei; D. Zhang; Z. Zhang";2022
Explainable Hybrid CNN and FNN Approach Applied on Robotic Wall-Following Behaviour Learning;Fuzzy Neural Network (FNN) applied to robotic control tasks has proved to be effective by previous researchers. However, FNN has an inherent deficiency in dealing with inputs of large dimensions, such as images. Therefore, this research utilizes a Convolutional Neural Network (CNN) model to convert image into distance values and delivers these values to FNN based robot controller as inputs. The proposed hybrid CNN+FNN are tested with both a regression model and a multi-task model. Results show that the multi-task method performs better with less information loss from input images. This paper also proved that the proposed hybrid approach can be generalized into an unknown robotic simulation environment and performs better than its FNN counterpart. By utilizing state of the art explainable analysis method, both the CNN part and the FNN part of the hybrid approach can be explained in a human-understandable way.;navigation, vision;no us ;Kwiatkowski J,Ou L,Chang YC,Lin CT;2022
Explainable Knowledge Graph Embedding: Inference Reconciliation for Knowledge Inferences Supporting Robot Actions;Learned knowledge graph representations supporting robots contain a wealth of domain knowledge that drives robot behavior. However, there does not exist an inference reconciliation framework that expresses how a knowledge graph representation affects a robot's sequential decision making. We use a pedagogical approach to explain the inferences of a learned, black-box knowledge graph representation, a knowledge graph embedding. Our interpretable model uses a decision tree classifier to locally approximate the predictions of the black-box model and provides natural language explanations interpretable by non-experts. Results from our algorithmic evaluation affirm our model design choices, and the results of our user studies with non-experts support the need for the proposed inference reconciliation framework. Critically, results from our simulated robot evaluation indicate that our explanations enable non-experts to correct erratic robot behaviors due to nonsensical beliefs within the black-box.;high-level dm;no us;"A. Daruna; D. Das; S. Chernova";2022
Explainable Product Quality Assessment in a Medical Device Assembly Pilot Line;New technologies and data analysis tools such as deep learning models can be beneficial for product quality assessment purposes. However, these black box models can be challenging due to uncertainty and lack of explainability in sensitive pharmaceutical processes. Therefore, different interpretable algorithms have been proposed to overcome the challenges in complex machine learning models. This paper presents an explainable deep-leaning-based fault detection method for quality assessment in an industrial medical device assembly line. This methodology consists of a multi-layer perceptron model that classifies the samples. Then a layer-wise relevance propagation algorithm seeks to explain the logic behind the prediction. Finally, the heatmap pertaining to relevance propagation visualizes the main contributors to the output prediction. Due to the small industrial dataset, a public dataset associated with a robot-driven screwdriving process assists in evaluating the current method-ology. The final results show that the classifier can diagnose different fault classes, and the LRP algorithm can highlight the essential input features and visualize the decision-making process. Furthermore, the LRP algorithm can be beneficial for diagnosing unknown abnormal samples due to the different distribution of contributing features in the heatmap figure. Moreover, a more reliable dimension reduction method can be applied by employing the LRP algorithm and selecting corresponding input data points with higher relevance.;self-monitoring;no us ;"F. Kakavandi; P. G. Larsen";2022
Explainable Reinforcement Learning in Human-Robot Teams: The Impact of Decision-Tree Explanations on Transparency;"Understanding the decisions of AI-driven systems and the rationale behind such decisions is key to the success of the human-robot team. However, the complexity and the ""black-box"" nature of many AI algorithms create a barrier for establishing such understanding within their human counterparts. Reinforcement Learning (RL), a machine-learning algorithm based on the simple idea of action-reward mappings, has a rich quantitative representation and a complex iterative reasoning process that present a significant obstacle to human understanding of, for example, how value functions are constructed, how the algorithms update the value functions, and how such updates impact the action/policy chosen by the robot. In this paper, we discuss our work to address this challenge by developing a decision-tree based explainable model for RL to make a robot’s decision-making process more transparent. Set in a human-robot virtual teaming testbed, we conducted a study to assess the impact of the explanations, generated using decision trees, on building transparency, calibrating trust, and improving the overall human-robot team’s performance. We discuss the design of the explainable model and the positive impact of the explanations on outcome measures.";recommender;social;"D. V. Pynadath; N. Gurney; N. Wang";2022
Explainable Robotic Plan Execution Monitoring Under Partial Observability;Successful plan generation for autonomous systems is necessary but not sufficient to guarantee reaching a goal state by an execution of a plan. Various discrepancies between an expected state and the observed state may occur during the plan execution (e.g., due to unexpected exogenous events, changes in the goals, or failure of robot parts) and these discrepancies may lead to plan failures. For that reason, autonomous systems should be equipped with execution monitoring algorithms so that they can autonomously recover from such discrepancies. We introduce a plan execution monitoring algorithm that operates under partial observability. This algorithm relies on novel formal methods for hybrid prediction, diagnosis and explanation generation, and planning. The prediction module generates an expected state after the execution of a part of the plan from an incomplete state to check for discrepancies. The diagnostic reasoning module generates meaningful hypotheses to explain failures of robot parts. Unlike the existing diagnosis methods, the previous hypotheses can be revised, based on new partial observations, increasing the accuracy of explanations as further information becomes available. The replanning module considers these explanations while computing a new plan that would avoid such failures. All these reasoning modules are hybrid in that they combine high-level logical reasoning with low-level feasibility checks based on probabilistic methods. We experimentally show that these hybrid formal reasoning modules improve the performance of plan execution monitoring. © 2004-2012 IEEE.;self-monitoring;no us;Coruhlu G., Erdem E., Patoglu V.;2022
Explaining Aha! moments in artificial agents through IKE-XAI: Implicit Knowledge Extraction for eXplainable AI;"During the learning process, a child develops a mental representation of the task he or she is learning. A Machine Learning algorithm develops also a latent representation of the task it learns. We investigate the development of the knowledge construction of an artificial agent through the analysis of its behavior, i.e., its sequences of moves while learning to perform the Tower of Hanoï (TOH) task. The TOH is a well-known task in experimental contexts to study the problem-solving processes and one of the fundamental processes of children's knowledge construction about their world. We position ourselves in the field of explainable reinforcement learning for developmental robotics, at the crossroads of cognitive modeling and explainable AI. Our main contribution proposes a 3-step methodology named Implicit Knowledge Extraction with eXplainable Artificial Intelligence (IKE-XAI) to extract the implicit knowledge, in form of an automaton, encoded by an artificial agent during its learning. We showcase this technique to solve and explain the TOH task when researchers have only access to moves that represent observational behavior as in human–machine interaction. Therefore, to extract the agent acquired knowledge at different stages of its training, our approach combines: first, a Q-learning agent that learns to perform the TOH task; second, a trained recurrent neural network that encodes an implicit representation of the TOH task; and third, an XAI process using a post-hoc implicit rule extraction algorithm to extract finite state automata. We propose using graph representations as visual and explicit explanations of the behavior of the Q-learning agent. Our experiments show that the IKE-XAI approach helps understanding the development of the Q-learning agent behavior by providing a global explanation of its knowledge evolution during learning. IKE-XAI also allows researchers to identify the agent's Aha! moment by determining from what moment the knowledge representation stabilizes and the agent no longer learns. © 2022 The Author(s)";high-level dm;no us;Chraibi Kaadoud I., Bennetot A., Mawhin B., Charisi V., Díaz-Rodríguez N.;2022
Explaining Local Path Plans Using LIME;As robots are becoming a more significant part of humans’ daily life, there is a challenge to bridge the gap between robots’ actions and humans’ understanding of what robots are doing and how they make their decisions. We present an approach to local navigation explanation based on Local Interpretable Model-agnostic Explanations (LIME), a popular approach from the Explainable Artificial Intelligence (XAI) community for explaining individual predictions of black-box models. We show how LIME can be applied to a robot’s local path planner. We experimentally evaluate the explanation method’s runtime, quality, and robustness, and discuss implications for the robotic domain. © 2022, The Author(s), under exclusive license to Springer Nature Switzerland AG.;navigation;no us;Halilovic A., Lindner F.;2022
Exploring the influence of a user-specific explainable virtual advisor on health behaviour change intentions;Virtual advisors (VAs) are being utilised almost in every service nowadays from entertainment to healthcare. To increase the user’s trust in these VAs and encourage the users to follow their advice, they should have the capability of explaining their decisions, particularly, when the decision is vital such as health advice. However, the role of an explainable VA in health behaviour change is understudied. There is evidence that people tend to change their intentions towards health behaviour when the persuasion message is linked to their mental state. Thus, this study explores this link by introducing an explainable VA that provides explanation according to the user’s mental state (beliefs and goals) rather than the agent’s mental state as commonly utilised in explainable agents. It further explores the influence of different explanation patterns that refer to beliefs, goals, or beliefs&goals on the user’s behaviour change. An explainable VA was designed to advise undergraduate students how to manage their study-related stress by motivating them to change certain behaviours. With 91 participants, the VA was evaluated and the results revealed that user-specific explanation could significantly encourage behaviour change intentions and build good user-agent relationship. Small differences were found between the three types of explanation patterns. © 2022, The Author(s).;recommender;social;Abdulrahman A., Richards D., Bilgin A.A.;2022
Geometric Task Networks: Learning Efficient and Explainable Skill Coordination for Object Manipulation;Complex manipulation tasks can contain various execution branches of primitive skills in sequence or in parallel under different scenarios. Manual specifications of such branching conditions and associated skill parameters are not only error-prone due to corner cases, but also quickly untraceable given a large number of objects and skills. On the other hand, learning from demonstration has increasingly shown to be an intuitive and effective way to program such skills for industrial robots. Parameterized skill representations allow generalization over new scenarios, which however makes the planning process much slower thus unsuitable for online applications. In this article, we propose a hierarchical and compositional planning framework that learns a geometric task network (GTN) from exhaustive planners, without any manual inputs. A GTN is a goal-dependent task graph that encapsulates both the transition relations among skill representations and the geometric constraints underlying these transitions. This framework has shown to improve dramatically the offline learning efficiency, the online performance, and the transparency of decision process, by leveraging the task-parameterized models. We demonstrate the approach on a 7-DoF robot arm both in simulation and on hardware solving various manipulation tasks. © 2021 IEEE.;high-level dm;no us;Guo M., Burger M.;2022
Hardware Implementation for Lower Limb Surface EMG Measurement and Analysis Using Explainable AI for Activity Recognition;Electromyography (EMG) signals are gaining popularity for several biomedical applications, including pattern recognition, disease detection, human-machine interfaces, medical image processing, and robotic limb or exoskeleton fabrication. In this study, a two-channel data acquisition system for measuring EMG signals is proposed for human lower limb activity recognition. Five leg activities have been accomplished to measure EMG signals from two lower limb muscles to validate the developed hardware. Five subjects (three males and two females) were chosen to acquire EMG signals during these activities. The raw EMG signal was first denoised using a hybrid of Wavelet Decomposition with Ensemble Empirical Mode Decomposition (WD-EEMD) approach to classify the recorded EMG dataset. Then, eight time-domain (TD) features were extracted using the overlapping windowing technique. An investigation into the comparative effectiveness of several classifiers is presented, although it was hard to distinguish how the classifiers predicted the activities. Having a trustworthy explanation for the outcomes of these classifiers would be quite beneficial overall. An approach known as explainable artificial intelligence (XAI) was introduced to produce trustworthy predictive modeling results and applied the XAI technique known as local interpretable model-agnostic explanations (LIME) to a straightforward human interpretation. LIME investigates how extracted features are anticipated and which features are most responsible for each action. The accuracy of the extra tree classifier gives the highest accuracy of the other studied algorithms for identifying different human lower limb activities from sEMG signals. © 1963-2012 IEEE.;user modelling;no us;Vijayvargiya A., Singh P., Kumar R., Dey N.;2022
Having the Right Attitude: How Attitude Impacts Trust Repair in Human-Robot Interaction;Robot co-workers, like human co-workers, make mistakes that undermine trust. Yet, trust is just as important in promoting human-robot collaboration as it is in promoting human-human collaboration. In addition, individuals can significantly differ in their attitudes toward robots, which can also impact or hinder their trust in robots. To better understand how individual attitude can influence trust repair strategies, we propose a theoretical model that draws from the theory of cognitive dissonance. To empirically verify this model, we conducted a between-subjects experiment with 100 participants assigned to one of four repair strategies (apologies, denials, explanations, or promises) over three trust violations. Individual attitudes did moderate the efficacy of repair strategies and this effect differed over successive trust violations. Specifically, repair strategies were most effective relative to individual attitude during the second of the three trust violations, and promises were the trust repair strategy most impacted by an individual's attitude.;high-level dm;error;Esterwood C,Robert LP;2022
Improving Visual Question Answering by Leveraging Depth and Adapting Explainability;During human-robot conversation, it is critical for robots to be able to answer users’ questions accurately and provide a suitable explanation for why they arrive at the answer they provide. Depth is a crucial component in producing more intelligent robots that can respond correctly as some questions might rely on spatial relations within the scene, for which 2D RGB data alone would be insufficient. Due to the lack of existing depth datasets for the task of VQA, we introduce a new dataset, VQA-SUNRGBD. When we compare our proposed model on this RGB-D dataset against the baseline VQN network on RGB data alone, we show that ours outperforms, particularly in questions relating to depth such as asking about the proximity of objects and relative positions of objects to one another. We also provide Grad-CAM activations to gain insight regarding the predictions on depth-related questions and find that our method produces better visual explanations compared to Grad-CAM on RGB data. To our knowledge, this work is the first of its kind to leverage depth and an explainability module to produce an explainable Visual Question Answering (VQA) system.;range/3d;no us;"A. Panesar; F. I. Doğan; I. Leite";2022
In-Hand Object Recognition with Innervated Fiber Optic Spectroscopy for Soft Grippers;Previous work in material sensing with soft robots has focused on integrating flexible force sensors or optical waveguides to infer object shape and mass from experimental data. In this work, we present a novel modular sensing platform integrated into a hybrid-manufactured soft robot gripper to collect and process high-fidelity spectral information. The custom design of the gripper is realized using 3D printing and casting. We embed full-spectrum light sources paired with lensed fiber optic cables within an optically clear gel, to collect multi-point spectral reflectivity curves in the Visible to Near Infrared (VNIR) segment of the electromagnetic spectrum. We introduce a processing pipeline to collect, clean, and merge multiple spectral readings. As a demonstration of sensor capabilities, we gather sample readings from several similarly-shaped and textured items to show how spectroscopy enables explainable differentiation between objects. The integration of spectroscopic data presents a promising new sensing modality for soft robots to understand the material composition of grasped items, facilitating numerous applications for food-processing and manufacturing.;range/3d;no us;"N. Hanson; H. Hochsztein; A. Vaidya; J. Willick; K. Dorsey; T. Padir";2022
